{
  "schema": "proof.operator.schema-manifest/v1",
  "contract": "proof-operator-control/v1",
  "dialect": "https://json-schema.org/draft/2020-12/schema",
  "validator": {
    "meta_validator": "python-jsonschema Draft202012Validator.check_schema",
    "runtime_decoder": "typed serde visitor before serde_json::Value",
    "duplicate_policy": "reject recursively before value construction",
    "unknown_field_policy": "reject recursively",
    "format_policy": "schema plus runtime UUIDv7, RFC3339 UTC, canonical-order, and digest validation"
  },
  "files": [
    {
      "path": "schemas/operator-control/common-v1.schema.json",
      "id": "https://proof.local/schemas/operator-control/common/v1",
      "sha256": "sha256:e64b2278a81db61ccf333005274990366047e133c9a507915c4123e641c3412b"
    },
    {
      "path": "schemas/operator-control/auth-v1.schema.json",
      "id": "https://proof.local/schemas/operator-control/auth/v1",
      "sha256": "sha256:8ec5777fbb9c7a36484f3503a04f36dd297a880f6cf9c0ba7737384461c5c37d"
    },
    {
      "path": "schemas/operator-control/reads-v1.schema.json",
      "id": "https://proof.local/schemas/operator-control/reads/v1",
      "sha256": "sha256:acbf50d28c57129794e8becb92236706794468f3ace63afc0a80fcfed1ce29c5"
    },
    {
      "path": "schemas/operator-control/mutations-v1.schema.json",
      "id": "https://proof.local/schemas/operator-control/mutations/v1",
      "sha256": "sha256:0d0ea379971e673fc45cd47d38896b18ddf06712f872ca5a6363d6b07ecf940c"
    },
    {
      "path": "schemas/operator-control/durable-v1.schema.json",
      "id": "https://proof.local/schemas/operator-control/durable/v1",
      "sha256": "sha256:20c7380cad0692f7459bbb6b4d06d2a9b18810f99e45963fa1941d4f5733f719"
    },
    {
      "path": "schemas/operator-control/store-v1.schema.json",
      "id": "https://proof.local/schemas/operator-control/store/v1",
      "sha256": "sha256:afb321e63ae8884ace0be83c7cad08f1a22e60876a082cf092dc7081d66ef4ab"
    },
    {
      "path": "schemas/operator-control/evaluator-v1.schema.json",
      "id": "https://proof.local/schemas/operator-control/evaluator/v1",
      "sha256": "sha256:1fae78f5c452ae35a4ab536d1e6e12cf8ae9ec51de4915cd8ff4180a36c9d2c6"
    },
    {
      "path": "schemas/operator-control/manifest-v1.schema.json",
      "id": "https://proof.local/schemas/operator-control/manifest/v1",
      "sha256": "sha256:685f683910f0956987db08a1646aa2aee5f5d884fc13634fb80fa4bbf08467d6"
    }
  ],
  "logical_shapes": [
    {
      "name": "UuidV7",
      "schema_path": "schemas/operator-control/common-v1.schema.json",
      "json_pointer": "#/$defs/UuidV7"
    },
    {
      "name": "Rfc3339Utc",
      "schema_path": "schemas/operator-control/common-v1.schema.json",
      "json_pointer": "#/$defs/Rfc3339Utc"
    },
    {
      "name": "SafeInteger",
      "schema_path": "schemas/operator-control/common-v1.schema.json",
      "json_pointer": "#/$defs/SafeInteger"
    },
    {
      "name": "KernelContentDigest",
      "schema_path": "schemas/operator-control/common-v1.schema.json",
      "json_pointer": "#/$defs/KernelContentDigest"
    },
    {
      "name": "ControlDigest",
      "schema_path": "schemas/operator-control/common-v1.schema.json",
      "json_pointer": "#/$defs/ControlDigest"
    },
    {
      "name": "ArtifactDigest",
      "schema_path": "schemas/operator-control/common-v1.schema.json",
      "json_pointer": "#/$defs/ArtifactDigest"
    },
    {
      "name": "Capability",
      "schema_path": "schemas/operator-control/common-v1.schema.json",
      "json_pointer": "#/$defs/Capability"
    },
    {
      "name": "CapabilitySet",
      "schema_path": "schemas/operator-control/common-v1.schema.json",
      "json_pointer": "#/$defs/CapabilitySet"
    },
    {
      "name": "ErrorEnvelope",
      "schema_path": "schemas/operator-control/common-v1.schema.json",
      "json_pointer": "#/$defs/ErrorEnvelope"
    },
    {
      "name": "BudgetAmounts",
      "schema_path": "schemas/operator-control/common-v1.schema.json",
      "json_pointer": "#/$defs/BudgetAmounts"
    },
    {
      "name": "ZeroEffectCounters",
      "schema_path": "schemas/operator-control/common-v1.schema.json",
      "json_pointer": "#/$defs/ZeroEffectCounters"
    },
    {
      "name": "ReviewField",
      "schema_path": "schemas/operator-control/common-v1.schema.json",
      "json_pointer": "#/$defs/ReviewField"
    },
    {
      "name": "ChallengeIssueRequest",
      "schema_path": "schemas/operator-control/auth-v1.schema.json",
      "json_pointer": "#/$defs/ChallengeIssueRequest"
    },
    {
      "name": "SessionChallenge",
      "schema_path": "schemas/operator-control/auth-v1.schema.json",
      "json_pointer": "#/$defs/SessionChallenge"
    },
    {
      "name": "ChallengeIssueResponse",
      "schema_path": "schemas/operator-control/auth-v1.schema.json",
      "json_pointer": "#/$defs/ChallengeIssueResponse"
    },
    {
      "name": "SessionAttestation",
      "schema_path": "schemas/operator-control/auth-v1.schema.json",
      "json_pointer": "#/$defs/SessionAttestation"
    },
    {
      "name": "SessionExchangeRequest",
      "schema_path": "schemas/operator-control/auth-v1.schema.json",
      "json_pointer": "#/$defs/SessionExchangeRequest"
    },
    {
      "name": "SessionExchangeResponse",
      "schema_path": "schemas/operator-control/auth-v1.schema.json",
      "json_pointer": "#/$defs/SessionExchangeResponse"
    },
    {
      "name": "SessionClaims",
      "schema_path": "schemas/operator-control/auth-v1.schema.json",
      "json_pointer": "#/$defs/SessionClaims"
    },
    {
      "name": "GrantedCapabilityIntersection",
      "schema_path": "schemas/operator-control/auth-v1.schema.json",
      "json_pointer": "#/$defs/GrantedCapabilityIntersection"
    },
    {
      "name": "AttentionQuery",
      "schema_path": "schemas/operator-control/reads-v1.schema.json",
      "json_pointer": "#/$defs/AttentionQuery"
    },
    {
      "name": "RunAttentionItem",
      "schema_path": "schemas/operator-control/reads-v1.schema.json",
      "json_pointer": "#/$defs/RunAttentionItem"
    },
    {
      "name": "ApprovalAttentionItem",
      "schema_path": "schemas/operator-control/reads-v1.schema.json",
      "json_pointer": "#/$defs/ApprovalAttentionItem"
    },
    {
      "name": "AttentionPage",
      "schema_path": "schemas/operator-control/reads-v1.schema.json",
      "json_pointer": "#/$defs/AttentionPage"
    },
    {
      "name": "CheckpointTail",
      "schema_path": "schemas/operator-control/reads-v1.schema.json",
      "json_pointer": "#/$defs/CheckpointTail"
    },
    {
      "name": "BudgetSnapshot",
      "schema_path": "schemas/operator-control/reads-v1.schema.json",
      "json_pointer": "#/$defs/BudgetSnapshot"
    },
    {
      "name": "RunDetail",
      "schema_path": "schemas/operator-control/reads-v1.schema.json",
      "json_pointer": "#/$defs/RunDetail"
    },
    {
      "name": "ApprovalQuery",
      "schema_path": "schemas/operator-control/reads-v1.schema.json",
      "json_pointer": "#/$defs/ApprovalQuery"
    },
    {
      "name": "ApprovalSummary",
      "schema_path": "schemas/operator-control/reads-v1.schema.json",
      "json_pointer": "#/$defs/ApprovalSummary"
    },
    {
      "name": "ApprovalPage",
      "schema_path": "schemas/operator-control/reads-v1.schema.json",
      "json_pointer": "#/$defs/ApprovalPage"
    },
    {
      "name": "ApprovalDetail",
      "schema_path": "schemas/operator-control/reads-v1.schema.json",
      "json_pointer": "#/$defs/ApprovalDetail"
    },
    {
      "name": "CommandQuery",
      "schema_path": "schemas/operator-control/reads-v1.schema.json",
      "json_pointer": "#/$defs/CommandQuery"
    },
    {
      "name": "CommandPage",
      "schema_path": "schemas/operator-control/reads-v1.schema.json",
      "json_pointer": "#/$defs/CommandPage"
    },
    {
      "name": "AuditQuery",
      "schema_path": "schemas/operator-control/reads-v1.schema.json",
      "json_pointer": "#/$defs/AuditQuery"
    },
    {
      "name": "AuditEvent",
      "schema_path": "schemas/operator-control/reads-v1.schema.json",
      "json_pointer": "#/$defs/AuditEvent"
    },
    {
      "name": "AuditPage",
      "schema_path": "schemas/operator-control/reads-v1.schema.json",
      "json_pointer": "#/$defs/AuditPage"
    },
    {
      "name": "CursorClaims",
      "schema_path": "schemas/operator-control/reads-v1.schema.json",
      "json_pointer": "#/$defs/CursorClaims"
    },
    {
      "name": "CommandBinding",
      "schema_path": "schemas/operator-control/mutations-v1.schema.json",
      "json_pointer": "#/$defs/CommandBinding"
    },
    {
      "name": "ApprovalDecisionCommand",
      "schema_path": "schemas/operator-control/mutations-v1.schema.json",
      "json_pointer": "#/$defs/ApprovalDecisionCommand"
    },
    {
      "name": "RunCancelCommand",
      "schema_path": "schemas/operator-control/mutations-v1.schema.json",
      "json_pointer": "#/$defs/RunCancelCommand"
    },
    {
      "name": "RunResumeCommand",
      "schema_path": "schemas/operator-control/mutations-v1.schema.json",
      "json_pointer": "#/$defs/RunResumeCommand"
    },
    {
      "name": "SessionRevokeRequest",
      "schema_path": "schemas/operator-control/mutations-v1.schema.json",
      "json_pointer": "#/$defs/SessionRevokeRequest"
    },
    {
      "name": "CommandKind",
      "schema_path": "schemas/operator-control/mutations-v1.schema.json",
      "json_pointer": "#/$defs/CommandKind"
    },
    {
      "name": "CommandOutcome",
      "schema_path": "schemas/operator-control/mutations-v1.schema.json",
      "json_pointer": "#/$defs/CommandOutcome"
    },
    {
      "name": "CommandReceipt",
      "schema_path": "schemas/operator-control/mutations-v1.schema.json",
      "json_pointer": "#/$defs/CommandReceipt"
    },
    {
      "name": "PrincipalBinding",
      "schema_path": "schemas/operator-control/durable-v1.schema.json",